{
  "resume_data": {
    "name": "MOHIB ABBAS",
    "email": "m0hibsayed1393@gmail.com",
    "mobile_number": "7718099523",
    "skills": [
      "Reports",
      "Github",
      "Javascript",
      "Analysis",
      "Scripting",
      "Engineering",
      "International",
      "Js",
      "Css",
      "Access",
      "C++",
      "Mysql",
      "System",
      "Python",
      "Windows",
      "Website",
      "Technical",
      "C",
      "Html",
      "Pdf",
      "Php",
      "Vendors"
    ],
    "college_name": null,
    "degree": [
      "Bachelor of Engineering in Computer Engineering"
    ],
    "designation": [
      "Technical Executive, COMPUTER SOCIETY OF INDIA [CSI-TSEC]"
    ],
    "experience": [
      "SD Intern, TeamLease Edtech",
      "| Offer Letter",
      "May. 2023",
      "Developed an Online Program Management (OPM) Calculator to build \"Analysis P&L\" Report.",
      "Developed Reports using BI Tools like Looker Studio, Apache Superset.",
      "Automated day-to-day MySQL Backup  & compressing into 7-Zip using Windows Batch Scripting.",
      "Co-Founder & FreeLancer, Meeran Web Architects",
      "| meeranweb.com",
      "Jan. 2023",
      "Co-founded web development agency with 4 colleagues to build real-world websites for businesses.",
      "Created a website for ARISPL, Abhay Rana Infra Services Private Limited | arispl.in",
      "Intern, Hamari Pahchan NGO | Certificate",
      "Aug. 2022",
      "Worked as a Digital Media Marketeer of various NGO programmes being held.",
      "EXTRACURRICULAR",
      "Technical Executive, COMPUTER SOCIETY OF INDIA [CSI-TSEC]",
      "| Certificate",
      "Nov. 2022",
      "Worked as a team and developed website for CSI-TSEC.",
      "Organised 48-hour Hybrid Rubix'23 Hackathon having 70+ teams across India.",
      "| Top 10 Certificate | Certificate",
      "ERR_404 5.0 Hackathon",
      "Built an appointment Management system to book & decline appointments, monitoring slots.",
      "TSEC HACKS Hackathon",
      "| Certificate",
      "Mar. 2023",
      "Feb. 2023",
      "Built an Online Barter System, 'DIGI BARTER' to facilitate online Barter trade among users using MERN.",
      "CODEISSANCE Hackathon",
      "| Certificate",
      "Sep. 2022",
      "EduStacks, a web app having student-teacher interface that allows teachers to upload notices/articles."
    ],
    "company_names": [
      "Abhay Rana Infra Services Private Limited"
    ],
    "no_of_pages": 1,
    "total_experience": 0.0
  },
  "resume_text": "MOHIB ABBAS SAYED\n\n\u0083  +91 7718099523          m0hibsayed1393@gmail.com        \n Linkedin/mohib          \u00b7 Github/mohib            Codechef/mohib\n\nEDUCATION\nThadomal Shahani Engineering College\nBachelor of Engineering in Computer Engineering\nSt. Rocks College of Commerce, Science\nHigher Secondary School Certificate [HSC]\nRyan International School\nIndian Certificate of Secondary Education [ICSE]\nTECHNICAL SKILLS\nTechnologies/Frameworks: ReactJs, NextJs, Typescript, Javascript, HTML, CSS, PHP, C, C++, Tailwind CSS,\nMySQL, Python, Batch Script\nTools: Figma, Framer, Looker Studio, Apache Superset, Git, GitHub\nPROJECTS\nUrban Garden [Reactjs, MongoDB, Nodejs, Expressjs]\n\nCGPA 9.11/10\nJan. 2022 - June. 2025\nGRADE 92.67\nAug. 2019 - June. 2021\nGRADE 89.00\nMar. 2019\n\nMar. 2023\n\n| Source Code\n\nDeveloped a web app that acts as a marketplace for nursery vendors to upscale their businesses,\nexpand their reach to other customers.\nPersonal Recommendation system for better user experience based on location and past order history.\nNov. 2022\n\n| Source Code\n\nTime Desk [HTML, CSS, JS, PHP]\n\nDeveloped a web app to manage attendance of students studying in instituitions in an efficient way.\nThis web app provides an admin and a faculty interface. Admin registers the faculty in the web app to\ngrant access for managing attendance.\nFaculty can register the student entries of a class, mark attendance of each student, delete a student\nentry, share attendance sheet in pdf form.\n\nOrganicies [HTML, CSS, JS]\n\n| Source Code\n\nA static website for veggies and fruits delivering e-commerce 'Organicies' .\nUser can browse through the products available on Organicies and view details.\n\nEXPERIENCE\nSD Intern, TeamLease Edtech\n\n| Offer Letter\n\nMar. 2022\n\nMay. 2023\n\nDeveloped an Online Program Management (OPM) Calculator to build \"Analysis P&L\" Report.\nDeveloped Reports using BI Tools like Looker Studio, Apache Superset.\nAutomated day-to-day MySQL Backup  & compressing into 7-Zip using Windows Batch Scripting.\n\nCo-Founder & FreeLancer, Meeran Web Architects\n\n| meeranweb.com\n\nJan. 2023\n\nCo-founded web development agency with 4 colleagues to build real-world websites for businesses.\nCreated a website for ARISPL, Abhay Rana Infra Services Private Limited | arispl.in\n\nIntern, Hamari Pahchan NGO | Certificate\n\nWorked as a Digital Media Marketeer of various NGO programmes being held.\n\nEXTRACURRICULAR\nTechnical Executive, COMPUTER SOCIETY OF INDIA [CSI-TSEC]\n\n| Certificate\n\nWorked as a team and developed website for CSI-TSEC.\nOrganised 48-hour Hybrid Rubix'23 Hackathon having 70+ teams across India.\n\nERR_404 5.0 Hackathon\n\n| Top 10 Certificate | Certificate\n\nBuilt an appointment Management system to book & decline appointments, monitoring slots.\n\nTSEC HACKS Hackathon\n\n| Certificate\n\nAug. 2022\n\nNov. 2022\n\nMar. 2023\n\nFeb. 2023\n\nBuilt an Online Barter System, 'DIGI BARTER' to facilitate online Barter trade among users using MERN.\n\nCODEISSANCE Hackathon\n\nSep. 2022\nEduStacks, a web app having student-teacher interface that allows teachers to upload notices/articles.\n\n| Certificate\n\n\f",
  "candidate_level": "Fresher",
  "recommended_skills": [
    "React",
    "Django",
    "Node JS",
    "React JS",
    "php",
    "laravel",
    "Magento",
    "wordpress",
    "Javascript",
    "Angular JS",
    "c#",
    "Flask",
    "SDK"
  ],
  "recommended_keywords": [
    "React",
    "Django",
    "Node JS",
    "React JS",
    "php",
    "laravel",
    "Magento",
    "wordpress",
    "Javascript",
    "Angular JS",
    "c#",
    "Flask",
    "SDK"
  ],
  "recommended_courses": [
    {
      "name": "Flask: Develop Web Applications in Python",
      "link": "https://www.educative.io/courses/flask-develop-web-applications-in-python"
    },
    {
      "name": "Node.js and Express.js [Free]",
      "link": "https://youtu.be/Oe421EPjeBE"
    },
    {
      "name": "React Crash Course [Free]",
      "link": "https://youtu.be/Dorf8i6lCuk"
    },
    {
      "name": "ReactJS Project Development Training",
      "link": "https://www.dotnettricks.com/training/masters-program/reactjs-certification-training"
    }
  ]
}